index,image,name,effect
0,https://www.serebii.net/itemdex/sprites/beastball.png,Beast Ball,A somewhat different Poke Ball that is not very effective when catching Pokemon.
1,https://www.serebii.net/itemdex/sprites/cherishball.png,Cherish Ball,A quite rare Poke Ball made to commemorate a special occasion of some sort.
2,https://www.serebii.net/itemdex/sprites/diveball.png,Dive Ball,A somewhat different Poke Ball that is more effective when catching Pokemon in or on the water.
3,https://www.serebii.net/itemdex/sprites/dreamball.png,Dream Ball,A somewhat different Poke Ball that is more effective when catching Pokemon that are asleep.
4,https://www.serebii.net/itemdex/sprites/duskball.png,Dusk Ball,"A somewhat different Poke Ball that is more effective when catching Pokemon at night or in dark places, such as caves."
5,https://www.serebii.net/itemdex/sprites/fastball.png,Fast Ball,A somewhat different Poke Ball that is more effective when catching Pokemon that are usually very quick to run away.
6,https://www.serebii.net/itemdex/sprites/featherball.png,Feather Ball,A ball that flies fast and true—ideal for catching nimble Pokemon or Pokemon that fly high in the air.
7,https://www.serebii.net/itemdex/sprites/friendball.png,Friend Ball,A somewhat different Poke Ball that makes a wild Pokemon more friendly toward you immediately after its caught.
8,https://www.serebii.net/itemdex/sprites/gigatonball.png,Gigaton Ball,"The ultimate iteration of the Heavy Ball. A ball that is too heavy to fly high or far, but it is highly effective if you manage to hit an unsuspecting Pokemon."
9,https://www.serebii.net/itemdex/sprites/greatball.png,Great Ball,"A good, high-performance Poke Ball that provides a higher success rate for catching Pokemon than a standard Poke Ball."
10,https://www.serebii.net/itemdex/sprites/greatballlegends.png,Great Ball,A mysterious ball that provides a higher success rate for catching Pokemon than a standard Poke Ball does.
11,https://www.serebii.net/itemdex/sprites/healball.png,Heal Ball,A remedial Poke Ball that restores HP and eliminates status conditions for a Pokemon caught with it.
12,https://www.serebii.net/itemdex/sprites/heavyball.png,Heavy Ball,A somewhat different Poke Ball that becomes more effective the heavier the Pokemon is.
13,https://www.serebii.net/itemdex/sprites/heavyballlegends.png,Heavy Ball,"A ball that is too heavy to fly high or far, but it is highly effective if you manage to hit an unsuspecting Pokemon."
14,https://www.serebii.net/itemdex/sprites/jetball.png,Jet Ball,The ultimate iteration of the Feather Ball. A ball that flies fast and true—ideal for catching nimble Pokemon or Pokemon that fly high in the air.
15,https://www.serebii.net/itemdex/sprites/leadenball.png,Leaden Ball,"An improvement on the original Heavy Ball design. A ball that is too heavy to fly high or far, but it is highly effective if you manage to hit an unsuspecting Pokemon."
16,https://www.serebii.net/itemdex/sprites/levelball.png,Level Ball,A somewhat different Poke Ball that becomes more effective the lower the level of the Pokemon compared to your own Pokemon.
17,https://www.serebii.net/itemdex/sprites/loveball.png,Love Ball,A somewhat different Poke Ball that is more effective when catching Pokemon of the opposite gender to your own Pokemon.
18,https://www.serebii.net/itemdex/sprites/lureball.png,Lure Ball,A somewhat different Poke Ball that is more effective when catching Pokemon in or on the water.
19,https://www.serebii.net/itemdex/sprites/luxuryball.png,Luxury Ball,A particularly comfortable Poke Ball that makes a wild Pokemon quickly grow friendlier after being caught.
20,https://www.serebii.net/itemdex/sprites/masterball.png,Master Ball,"The very best Poke Ball with the ultimate level of performance. With it, you will catch any wild Pokemon without fail."
21,https://www.serebii.net/itemdex/sprites/moonball.png,Moon Ball,A somewhat different Poke Ball that is more effective when catching Pokemon that can be evolved using a Moon Stone.
22,https://www.serebii.net/itemdex/sprites/nestball.png,Nest Ball,A somewhat different Poke Ball that becomes more effective the lower the level of the wild Pokemon.
23,https://www.serebii.net/itemdex/sprites/netball.png,Net Ball,A somewhat different Poke Ball that is more effective when catching Water- or Bug-type Pokemon.
24,https://www.serebii.net/itemdex/sprites/originball.png,Origin Ball,A singular and irreplicable Poke Ball that can be used to catch the frenzied Pokemon raging at the Temple of Sinnoh.
25,https://www.serebii.net/itemdex/sprites/parkball.png,Park Ball,A special Poke Ball used in the Pal Park.
26,https://www.serebii.net/itemdex/sprites/pokeball.png,Poke Ball,"A device for catching wild Pokemon. Its thrown like a ball at a Pokemon, comfortably encapsulating its target."
27,https://www.serebii.net/itemdex/sprites/pokeballlegends.png,Poke Ball,A mysterious ball that can be thrown at wild Pokemon in order to catch them. These balls can be crafted by hand if you gather the necessary materials.
28,https://www.serebii.net/itemdex/sprites/premierball.png,Premier Ball,A somewhat rare Poke Ball made to commemorate a special occasion of some sort.
29,https://www.serebii.net/itemdex/sprites/quickball.png,Quick Ball,A somewhat different Poke Ball that is more effective at catching Pokemon when used first thing in a battle.
30,https://www.serebii.net/itemdex/sprites/repeatball.png,Repeat Ball,A somewhat different Poke Ball that is more effective when catching a Pokemon of a species that youve caught before.
31,https://www.serebii.net/itemdex/sprites/safariball.png,Safari Ball,A special Poke Ball used in locales such as the Safari Zone in the Kanto region and the Great Marsh in the Sinnoh region.
32,https://www.serebii.net/itemdex/sprites/sportball.png,Sport Ball,A special Poke Ball that was used during the Bug-Catching Contest in the Johto region.
33,https://www.serebii.net/itemdex/sprites/strangeball.png,Strange Ball,
34,https://www.serebii.net/itemdex/sprites/timerball.png,Timer Ball,A somewhat different Poke Ball that becomes more effective at catching Pokemon the more turns that are taken in battle.
35,https://www.serebii.net/itemdex/sprites/ultraball.png,Ultra Ball,An ultra-high-performance Poke Ball that provides a higher success rate for catching Pokemon than a Great Ball.
36,https://www.serebii.net/itemdex/sprites/ultraballlegends.png,Ultra Ball,A mysterious ball that provides an even higher success rate for catching Pokemon than a Great Ball does.
37,https://www.serebii.net/itemdex/sprites/wingball.png,Wing Ball,An improvement on the original Feather Ball design. A ball that flies fast and true—ideal for catching nimble Pokemon or Pokemon that fly high in the air.
38,https://www.serebii.net/itemdex/sprites/abilityshield.png,Ability Shield,An item to be held by a Pokemon. This cute and rather unique-looking shield protects the holder from having its Ability changed by others.
39,https://www.serebii.net/itemdex/sprites/absorbbulb.png,Absorb Bulb,An item to be held by a Pokemon. This single-use bulb boosts the Sp. Atk stat if the holder is damaged by a Water-type attack.
40,https://www.serebii.net/itemdex/sprites/adamantcrystal.png,Adamant Crystal,"An item to be held by Dialga. This large, glowing gem wells with power and allows the Pokemon to change form."
41,https://www.serebii.net/itemdex/sprites/adamantorb.png,Adamant Orb,A brightly shining gem to be held by Dialga. It boosts the power of Dialgas Dragon- and Steel-type moves.
42,https://www.serebii.net/itemdex/sprites/airballoon.png,Air Balloon,"An item to be held by a Pokemon. This balloon makes the holder float in the air. If the holder is hit with an attack, the balloon will burst."
43,https://www.serebii.net/itemdex/sprites/aloraichiumz.png,Aloraichium Z,It converts Z-Power into crystals that upgrade Alolan Raichus Thunderbolt to a Z-Move.
44,https://www.serebii.net/itemdex/sprites/amuletcoin.png,Amulet Coin,An item to be held by a Pokemon. It doubles any prize money received as long as the holder joins the battle at least once.
45,https://www.serebii.net/itemdex/sprites/assaultvest.png,Assault Vest,An item to be held by a Pokemon. This offensive vest boosts the holders Sp. Def stat but prevents the use of status moves.
46,https://www.serebii.net/itemdex/sprites/berrysweet.png,Berry Sweet,"A berry-shaped sweet. When a Milcery holds this, it spins around happily."
47,"",Berserk Gene,Boosts ATTACK but causes confusion.
48,https://www.serebii.net/itemdex/sprites/bigroot.png,Big Root,An item to be held by a Pokemon. This root boosts the amount of HP the holder restores to itself when it uses HP-stealing moves.
49,https://www.serebii.net/itemdex/sprites/bindingband.png,Binding Band,An item to be held by a Pokemon. This band boosts the power of binding moves used by the holder.
50,https://www.serebii.net/itemdex/sprites/blackbelt.png,Black Belt,An item to be held by a Pokemon. This belt helps with focus and boosts the power of the holders Fighting-type moves.
51,https://www.serebii.net/itemdex/sprites/blackglasses.png,Black Glasses,An item to be held by a Pokemon. Its a pair of shady- looking glasses that boost the power of the holders Dark-type moves.
52,https://www.serebii.net/itemdex/sprites/blacksludge.png,Black Sludge,"An item to be held by a Pokemon. If the holder is a Poison type, this sludge will gradually restore its HP. It damages any other type."
53,https://www.serebii.net/itemdex/sprites/blueorb.png,Blue Orb,A shiny blue orb that is said to have a deep connection to a legend of the Hoenn region.
54,https://www.serebii.net/itemdex/sprites/bluescarf.png,Blue Scarf,"When a Pokemon holds this during a contest, it looks even more beautiful than usual."
55,https://www.serebii.net/itemdex/sprites/blunderpolicy.png,Blunder Policy,"An item to be held by a Pokemon. If the holder misses with a move due to low accuracy, this policy will sharply boost its Speed stat."
56,https://www.serebii.net/itemdex/sprites/boosterenergy.png,Booster Energy,An item to be held by Pokemon with certain Abilities. The energy that fills this capsule boosts the strength of the Pokemon.
57,https://www.serebii.net/itemdex/sprites/brightpowder.png,Bright Powder,An item to be held by a Pokemon. This glittery powder casts a tricky glare that lowers the accuracy of opposing Pokemons moves.
58,https://www.serebii.net/itemdex/sprites/buggem.png,Bug Gem,An item to be held by a Pokemon. This gem is imbued with the essence of bugs and will boost the power of a Bug-type move—but only once.
59,https://www.serebii.net/itemdex/sprites/bugmemory.png,Bug Memory,A memory disc that contains Bug-type data. It changes the type of the holder if held by a certain species of Pokemon.
60,https://www.serebii.net/itemdex/sprites/buginiumz.png,Buginium Z,It converts Z-Power into crystals that upgrade Bug-type moves to Bug-type Z-Moves.
61,https://www.serebii.net/itemdex/sprites/burndrive.png,Burn Drive,A cassette to be held by Genesect. It changes Genesects Techno Blast move so it becomes Fire type.
62,https://www.serebii.net/itemdex/sprites/cellbattery.png,Cell Battery,An item to be held by a Pokemon. This single-use battery boosts the Attack stat if the holder is damaged by an Electric-type attack.
63,https://www.serebii.net/itemdex/sprites/charcoal.png,Charcoal,An item to be held by a Pokemon. Its a combustible fuel that boosts the power of the holders Fire-type moves.
64,https://www.serebii.net/itemdex/sprites/chilldrive.png,Chill Drive,A cassette to be held by Genesect. It changes Genesects Techno Blast move so it becomes Ice type.
65,https://www.serebii.net/itemdex/sprites/choiceband.png,Choice Band,An item to be held by a Pokemon. This curious headband boosts the holders Attack stat but only allows the use of a single move.
66,https://www.serebii.net/itemdex/sprites/choicescarf.png,Choice Scarf,An item to be held by a Pokemon. This curious scarf boosts the holders Speed stat but only allows the use of a single move.
67,https://www.serebii.net/itemdex/sprites/choicespecs.png,Choice Specs,An item to be held by a Pokemon. These curious glasses boost the holders Sp. Atk stat but only allow the use of a single move.
68,https://www.serebii.net/itemdex/sprites/cleansetag.png,Cleanse Tag,An item to be held by a Pokemon. It helps keep wild Pokemon away when the holder is the head of the party.
69,https://www.serebii.net/itemdex/sprites/clearamulet.png,Clear Amulet,"An item to be held by a Pokemon. This clear, sparkling amulet protects the holder from having its stats lowered by moves used against it or by other Pokemons Abilities."
70,https://www.serebii.net/itemdex/sprites/cloversweet.png,Clover Sweet,"A clover-shaped sweet. When a Milcery holds this, it spins around happily."
71,https://www.serebii.net/itemdex/sprites/cornerstonemask.png,Cornerstone Mask,An item to be held by Ogerpon. This carved wooden mask is adorned with crystals and allows Ogerpon to wield the Rock type during battle.
72,https://www.serebii.net/itemdex/sprites/covertcloak.png,Covert Cloak,"An item to be held by a Pokemon. This hooded cloak conceals the holder, tricking the eyes of its enemies and protecting it from the additional effects of moves."
73,https://www.serebii.net/itemdex/sprites/damprock.png,Damp Rock,"An item to be held by a Pokemon. When the holder changes the weather to rain, the rain will persist for longer than usual."
74,https://www.serebii.net/itemdex/sprites/darkgem.png,Dark Gem,An item to be held by a Pokemon. This gem is imbued with the essence of darkness and will boost the power of a Dark-type move—but only once.
75,https://www.serebii.net/itemdex/sprites/darkmemory.png,Dark Memory,A memory disc that contains Dark-type data. It changes the type of the holder if held by a certain species of Pokemon.
76,https://www.serebii.net/itemdex/sprites/darkiniumz.png,Darkinium Z,It converts Z-Power into crystals that upgrade Dark-type moves to Dark-type Z-Moves.
77,https://www.serebii.net/itemdex/sprites/decidiumz.png,Decidium Z,It converts Z-Power into crystals that upgrade Decidueyes Spirit Shackle to a Z-Move.
78,https://www.serebii.net/itemdex/sprites/deepseascale.png,Deep Sea Scale,An item to be held by Clamperl. This scale shines with a faint pink and boosts Clamperls Sp. Def stat.
79,https://www.serebii.net/itemdex/sprites/deepseatooth.png,Deep Sea Tooth,An item to be held by Clamperl. This fang gleams a sharp silver and boosts Clamperls Sp. Atk stat.
80,https://www.serebii.net/itemdex/sprites/destinyknot.png,Destiny Knot,"An item to be held by a Pokemon. Should the holder of this bright-red thread become infatuated, the Pokemon it is infatuated with will be similarly afflicted."
81,https://www.serebii.net/itemdex/sprites/dousedrive.png,Douse Drive,A cassette to be held by Genesect. It changes Genesects Techno Blast move so it becomes Water type.
82,https://www.serebii.net/itemdex/sprites/dracoplate.png,Draco Plate,An item to be held by a Pokemon. This stone tablet is imbued with the essence of dragons and boosts the power of the holders Dragon-type moves.
83,https://www.serebii.net/itemdex/sprites/dragonfang.png,Dragon Fang,"An item to be held by a Pokemon. This hard, sharp fang boosts the power of the holders Dragon-type moves."
84,https://www.serebii.net/itemdex/sprites/dragongem.png,Dragon Gem,An item to be held by a Pokemon. This gem is imbued with the essence of dragons and will boost the power of a Dragon-type move—but only once.
85,https://www.serebii.net/itemdex/sprites/dragonmemory.png,Dragon Memory,A memory disc that contains Dragon-type data. It changes the type of the holder if held by a certain species of Pokemon.
86,https://www.serebii.net/itemdex/sprites/dragoniumz.png,Dragonium Z,It converts Z-Power into crystals that upgrade Dragon-type moves to Dragon-type Z-Moves.
87,https://www.serebii.net/itemdex/sprites/dreadplate.png,Dread Plate,An item to be held by a Pokemon. This stone tablet is imbued with the essence of darkness and boosts the power of the holders Dark-type moves.
88,https://www.serebii.net/itemdex/sprites/dubiousdisc.png,Dubious Disc,A transparent device overflowing with dubious data. Its loved by a certain Pokemon.
89,https://www.serebii.net/itemdex/sprites/earthplate.png,Earth Plate,An item to be held by a Pokemon. This stone tablet is imbued with the essence of the earth and boosts the power of the holders Ground-type moves.
90,https://www.serebii.net/itemdex/sprites/eeviumz.png,Eevium Z,It converts Z-Power into crystals that upgrade Eevees Last Resort to a Z-Move.
91,https://www.serebii.net/itemdex/sprites/ejectbutton.png,Eject Button,"An item to be held by a Pokemon. If the holder is damaged by an attack, it will be switched out of battle to be replaced by another Pokemon on your team."
92,https://www.serebii.net/itemdex/sprites/ejectpack.png,Eject Pack,"An item to be held by a Pokemon. If the holders stats are lowered, it will be switched out of battle."
93,https://www.serebii.net/itemdex/sprites/electirizer.png,Electirizer,A box packed with a tremendous amount of electric energy. Its loved by a certain Pokemon.
94,https://www.serebii.net/itemdex/sprites/electricgem.png,Electric Gem,An item to be held by a Pokemon. This gem is imbued with the essence of electricity and will boost the power of an Electric-type move—but only once.
95,https://www.serebii.net/itemdex/sprites/electricmemory.png,Electric Memory,A memory disc that contains Electric-type data. It changes the type of the holder if held by a certain species of Pokemon.
96,https://www.serebii.net/itemdex/sprites/electricseed.png,Electric Seed,"An item to be held by a Pokemon. If the terrain becomes Electric Terrain, the holder will use this seed to boost its own Defense stat."
97,https://www.serebii.net/itemdex/sprites/electriumz.png,Electrium Z,It converts Z-Power into crystals that upgrade Electric-type moves to Electric-type Z-Moves.
98,https://www.serebii.net/itemdex/sprites/everstone.png,Everstone,An item to be held by a Pokemon. A Pokemon holding this peculiar stone is prevented from evolving.
99,https://www.serebii.net/itemdex/sprites/eviolite.png,Eviolite,An item to be held by a Pokemon. This mysterious evolutionary lump boosts the Defense and Sp. Def stats when held by a Pokemon that can still evolve.
100,https://www.serebii.net/itemdex/sprites/exp.share.png,Exp. Share,Turning on this special device will allow all the Pokemon on your team to share in Exp. Points gained.
101,https://www.serebii.net/itemdex/sprites/expertbelt.png,Expert Belt,An item to be held by a Pokemon. Its a well-worn belt that slightly boosts the power of the holders supereffective moves.
102,https://www.serebii.net/itemdex/sprites/fairiumz.png,Fairium Z,It converts Z-Power into crystals that upgrade Fairy-type moves to Fairy-type Z-Moves.
103,https://www.serebii.net/itemdex/sprites/fairyfeather.png,Fairy Feather,"An item to be held by a Pokemon. This feather, which gleams faintly when hit by light, boosts the power of the holders Fairy-type moves."
104,https://www.serebii.net/itemdex/sprites/fairygem.png,Fairy Gem,An item to be held by a Pokemon. This gem is imbued with the essence of fairies and will boost the power of a Fairy-type move—but only once.
105,https://www.serebii.net/itemdex/sprites/fairymemory.png,Fairy Memory,A memory disc that contains Fairy-type data. It changes the type of the holder if held by a certain species of Pokemon.
106,https://www.serebii.net/itemdex/sprites/fightinggem.png,Fighting Gem,An item to be held by a Pokemon. This gem is imbued with the essence of the fighting spirit and will boost the power of a Fighting-type move—but only once.
107,https://www.serebii.net/itemdex/sprites/fightingmemory.png,Fighting Memory,A memory disc that contains Fighting-type data. It changes the type of the holder if held by a certain species of Pokemon.
108,https://www.serebii.net/itemdex/sprites/fightiniumz.png,Fightinium Z,It converts Z-Power into crystals that upgrade Fighting-type moves to Fighting-type Z-Moves.
109,https://www.serebii.net/itemdex/sprites/firegem.png,Fire Gem,An item to be held by a Pokemon. This gem is imbued with the essence of fire and will boost the power of a Fire-type move—but only once.
110,https://www.serebii.net/itemdex/sprites/firememory.png,Fire Memory,A memory disc that contains Fire-type data. It changes the type of the holder if held by a certain species of Pokemon.
111,https://www.serebii.net/itemdex/sprites/firiumz.png,Firium Z,It converts Z-Power into crystals that upgrade Fire-type moves to Fire-type Z-Moves.
112,https://www.serebii.net/itemdex/sprites/fistplate.png,Fist Plate,An item to be held by a Pokemon. This stone tablet is imbued with the essence of the fighting spirit and boosts the power of the holders Fighting-type moves.
113,https://www.serebii.net/itemdex/sprites/flameorb.png,Flame Orb,An item to be held by a Pokemon. Its a bizarre orb that gives off heat when touched and will afflict the holder with a burn during battle.
114,https://www.serebii.net/itemdex/sprites/flameplate.png,Flame Plate,An item to be held by a Pokemon. This stone tablet is imbued with the essence of fire and boosts the power of the holders Fire-type moves.
115,https://www.serebii.net/itemdex/sprites/floatstone.png,Float Stone,An item to be held by a Pokemon. This very light stone reduces the weight of the holder.
116,https://www.serebii.net/itemdex/sprites/flowersweet.png,Flower Sweet,"A flower-shaped sweet. When a Milcery holds this, it spins around happily."
117,https://www.serebii.net/itemdex/sprites/flyinggem.png,Flying Gem,An item to be held by a Pokemon. This gem is imbued with the essence of flight and will boost the power of a Flying-type move—but only once.
118,https://www.serebii.net/itemdex/sprites/flyingmemory.png,Flying Memory,A memory disc that contains Flying-type data. It changes the type of the holder if held by a certain species of Pokemon.
119,https://www.serebii.net/itemdex/sprites/flyiniumz.png,Flyinium Z,It converts Z-Power into crystals that upgrade Flying-type moves to Flying-type Z-Moves.
120,https://www.serebii.net/itemdex/sprites/focusband.png,Focus Band,"An item to be held by a Pokemon. When the holder is hit with a move that should knock it out, it may be able to endure with 1 HP."
121,https://www.serebii.net/itemdex/sprites/focussash.png,Focus Sash,"An item to be held by a Pokemon. If the holder has full HP and it is hit with a move that should knock it out, it will endure with 1 HP—but only once."
122,https://www.serebii.net/itemdex/sprites/fullincense.png,Full Incense,An item to be held by a Pokemon. This incense has a curious aroma that makes the holder move slower than usual.
123,https://www.serebii.net/itemdex/sprites/ghostgem.png,Ghost Gem,An item to be held by a Pokemon. This gem is imbued with the essence of ghosts and will boost the power of a Ghost-type move—but only once.
124,https://www.serebii.net/itemdex/sprites/ghostmemory.png,Ghost Memory,A memory disc that contains Ghost-type data. It changes the type of the holder if held by a certain species of Pokemon.
125,https://www.serebii.net/itemdex/sprites/ghostiumz.png,Ghostium Z,It converts Z-Power into crystals that upgrade Ghost-type moves to Ghost-type Z-Moves.
126,https://www.serebii.net/itemdex/sprites/grassgem.png,Grass Gem,An item to be held by a Pokemon. This gem is imbued with the essence of plants and will boost the power of a Grass-type move—but only once.
127,https://www.serebii.net/itemdex/sprites/grassmemory.png,Grass Memory,A memory disc that contains Grass-type data. It changes the type of the holder if held by a certain species of Pokemon.
128,https://www.serebii.net/itemdex/sprites/grassiumz.png,Grassium Z,It converts Z-Power into crystals that upgrade Grass-type moves to Grass-type Z-Moves.
129,https://www.serebii.net/itemdex/sprites/grassyseed.png,Grassy Seed,"An item to be held by a Pokemon. If the terrain becomes Grassy Terrain, the holder will use this seed to boost its own Defense stat."
130,https://www.serebii.net/itemdex/sprites/greenscarf.png,Green Scarf,"When a Pokemon holds this during a contest, it looks even cleverer than usual."
131,https://www.serebii.net/itemdex/sprites/gripclaw.png,Grip Claw,"An item to be held by a Pokemon. When the holder uses moves that deal damage over several turns, such as Bind or Wrap, their effects will last longer than usual."
132,https://www.serebii.net/itemdex/sprites/griseouscore.png,Griseous Core,"An item to be held by Giratina. This large, glowing gem wells with power and allows the Pokemon to change form."
133,https://www.serebii.net/itemdex/sprites/griseousorb.png,Griseous Orb,A shining gem to be held by Giratina. It boosts the power of Giratinas Dragon- and Ghost-type moves.
134,https://www.serebii.net/itemdex/sprites/groundgem.png,Ground Gem,An item to be held by a Pokemon. This gem is imbued with the essence of the earth and will boost the power of a Ground-type move—but only once.
135,https://www.serebii.net/itemdex/sprites/groundmemory.png,Ground Memory,A memory disc that contains Ground-type data. It changes the type of the holder if held by a certain species of Pokemon.
136,https://www.serebii.net/itemdex/sprites/groundiumz.png,Groundium Z,It converts Z-Power into crystals that upgrade Ground-type moves to Ground-type Z-Moves.
137,https://www.serebii.net/itemdex/sprites/hardstone.png,Hard Stone,An item to be held by a Pokemon. Its a durable stone that boosts the power of the holders Rock-type moves.
138,https://www.serebii.net/itemdex/sprites/hearthflamemask.png,Hearthflame Mask,An item to be held by Ogerpon. This carved wooden mask is adorned with crystals and allows Ogerpon to wield the Fire type during battle.
139,https://www.serebii.net/itemdex/sprites/heatrock.png,Heat Rock,"An item to be held by a Pokemon. When the holder changes the weather to harsh sunlight, the sunlight will persist for longer than usual."
